{
  "source": "common",
  "version": "1.1.1",
  "title": "Common questions shared across requirement packages",
  "questions": [
    {
      "id": "product_form",
      "type": "choice",
      "level": "product",
      "label": "What kind of product is this?",
      "choices": [
        "standalone_software",
        "hardware_with_software",
        "hardware_component",
        "software_component"
      ],
      "guidance": "Software that is needed to operate the hardware (apps, drivers) is part of the product even when delivered separately. A component is placed on the market on its own for others to integrate."
    },
    {
      "id": "has_data_connection",
      "type": "boolean",
      "level": "software",
      "label": "Can the product exchange digital data with another device or network, directly or indirectly?",
      "guidance": "A data connection means deliberately encoded digital information is sent and read, by cable, radio or through other software. Merely switching a signal on and off to trigger or power something is not a data connection.",
      "guidance_url": "https://ec.europa.eu/newsroom/dae/redirection/document/131456",
      "implied_by": {
        "when": {
          "or": [
            {
              "==": [
                {
                  "var": "network_interface_capability"
                },
                "present"
              ]
            },
            {
              "==": [
                {
                  "var": "wireless_interface_capability"
                },
                "present"
              ]
            },
            {
              "in": [
                {
                  "var": "inbound_exposure_max"
                },
                [
                  "restricted_by_product",
                  "any_network"
                ]
              ]
            }
          ]
        },
        "value": true
      }
    },
    {
      "id": "processes_personal_data",
      "type": "boolean",
      "level": "software",
      "label": "Does the product process personal data?"
    },
    {
      "id": "economic_operator_role",
      "type": "choice",
      "level": "product",
      "label": "What is your role for this product?",
      "choices": [
        "manufacturer",
        "importer",
        "distributor",
        "authorised_representative",
        "steward"
      ],
      "guidance": "Manufacturer: develops or has it developed and markets it under its own name. Importer: places a product from outside the EU on the EU market. Distributor: makes it available further down the supply chain. Authorised representative: acts for a manufacturer under a written mandate. Steward: a legal person that systematically supports free and open-source software it does not itself place on the market."
    },
    {
      "id": "places_under_own_name_or_modifies",
      "type": "boolean",
      "level": "product",
      "label": "Do you place the product under your own name or trademark, or substantially modify it?",
      "condition": {
        "in": [
          {
            "var": "economic_operator_role"
          },
          [
            "importer",
            "distributor"
          ]
        ]
      },
      "guidance": "An importer or distributor that does either takes on the manufacturer's obligations."
    },
    {
      "id": "is_free_and_open_source",
      "type": "boolean",
      "level": "product",
      "label": "Is the product free and open-source software?",
      "guidance": "Two things both have to be true: the software is licensed to allow free use, modification and redistribution, AND its source code is openly shared -- publicly, not only with paying customers or a restricted group.",
      "guidance_url": "https://ec.europa.eu/newsroom/dae/redirection/document/131456"
    },
    {
      "id": "is_commercial_activity",
      "type": "boolean",
      "level": "product",
      "label": "Is the product supplied in the course of a commercial activity?",
      "guidance": "Ask whether access to the software itself (not just optional paid support around it) is conditioned on payment, used to monetise other products or services, requires personal-data processing unrelated to security or compatibility, or makes donations a de facto condition of access. Plain donations, sponsored development and not-for-profit entities reinvesting earnings generally do not count on their own.",
      "guidance_url": "https://ec.europa.eu/newsroom/dae/redirection/document/131456"
    },
    {
      "id": "is_medical_device",
      "type": "boolean",
      "level": "product",
      "label": "Is the product a medical device under Regulation (EU) 2017/745?"
    },
    {
      "id": "is_in_vitro_diagnostic",
      "type": "boolean",
      "level": "product",
      "label": "Is the product an in-vitro diagnostic medical device under Regulation (EU) 2017/746?"
    },
    {
      "id": "is_exclusively_vehicle_component",
      "type": "boolean",
      "level": "product",
      "label": "Is the product designed and built exclusively for vehicles type-approved under Regulation (EU) 2019/2144 or (EU) No 168/2013?",
      "guidance": "Only parts suitable solely for those vehicles count. Selling through channels open to anyone (retail, public web shop) shows the product is not exclusively for vehicles; restricted business channels in the automotive supply chain point the other way.",
      "guidance_url": "https://ec.europa.eu/newsroom/dae/redirection/document/131456"
    },
    {
      "id": "is_civil_aviation_product",
      "type": "boolean",
      "level": "product",
      "label": "Is the product certified under the EU civil aviation rules, Regulation (EU) 2018/1139?"
    },
    {
      "id": "is_marine_equipment",
      "type": "boolean",
      "level": "product",
      "label": "Is the product marine equipment under Directive 2014/90/EU?"
    },
    {
      "id": "is_exclusively_national_security_product",
      "type": "boolean",
      "level": "product",
      "label": "Is the product developed or modified exclusively for national security purposes?"
    },
    {
      "id": "is_exclusively_defence_product",
      "type": "boolean",
      "level": "product",
      "label": "Is the product developed or modified exclusively for defence purposes?"
    },
    {
      "id": "processes_classified_information",
      "type": "boolean",
      "level": "product",
      "label": "Is the product specifically designed to process classified information?",
      "guidance": "Such products may fall outside product legislation, but national rules on classified information (for example security accreditation by the national security authority) then apply instead."
    },
    {
      "id": "hardware_first_placed_on_market",
      "type": "date",
      "level": "hardware",
      "label": "When were the first units of this hardware revision placed on the market?",
      "guidance": "Placing on the market is the first time a unit is made available for distribution or use in the market. Hardware units count one by one."
    },
    {
      "id": "hardware_still_placed_on_market",
      "type": "boolean",
      "level": "hardware",
      "label": "Are units of this hardware revision still being placed on the market?"
    },
    {
      "id": "hardware_last_placed_on_market",
      "type": "date",
      "level": "hardware",
      "label": "When was the last unit of this hardware revision placed on the market?",
      "condition": {
        "==": [
          {
            "var": "hardware_still_placed_on_market"
          },
          false
        ]
      }
    },
    {
      "id": "software_first_placed_on_market",
      "type": "date",
      "level": "software",
      "label": "When was this software release first placed on the market?",
      "guidance": "All copies of one version count as placed when it is first offered. A release that only updates an earlier one without substantially modifying it keeps that earlier release's date.",
      "guidance_url": "https://ec.europa.eu/newsroom/dae/redirection/document/131456"
    },
    {
      "id": "network_interface_capability",
      "type": "choice",
      "level": "hardware",
      "label": "Does the hardware have a wired data interface (Ethernet, fieldbus, USB data, serial)?",
      "choices": [
        "not_present",
        "present",
        "present_physically_disabled"
      ]
    },
    {
      "id": "wireless_interface_capability",
      "type": "choice",
      "level": "hardware",
      "label": "Does the hardware have a radio (Wi-Fi, Bluetooth, cellular, other)?",
      "choices": [
        "not_present",
        "present",
        "present_physically_disabled"
      ]
    },
    {
      "id": "physical_debug_interface",
      "type": "choice",
      "level": "hardware",
      "label": "Does the hardware expose debug or test ports (JTAG, SWD, UART console), and how are they protected in shipped units?",
      "choices": [
        "not_present",
        "present_open",
        "present_access_controlled",
        "disabled_in_production"
      ]
    },
    {
      "id": "inbound_exposure_default",
      "type": "choice",
      "level": "software",
      "label": "In the shipped configuration, from where can the product accept inbound connections?",
      "choices": [
        "none",
        "same_device_only",
        "restricted_by_product",
        "any_network"
      ],
      "guidance": "Answer for the most exposed service (listening port, API, remote administration). 'Restricted by product' means the product itself limits who can connect, e.g. binds to one interface, allow-lists peers or only accepts connections through a tunnel it terminates. A VPN or firewall the operator puts in front is not a product property; see the network isolation question."
    },
    {
      "id": "inbound_exposure_max",
      "type": "choice",
      "level": "software",